<?xml version="1.0" encoding="utf-8"?>
<Program name="Riverscapes" xmlns:xsi="http://www.w3.org/2001/XMLSchema-instance"
  xsi:noNamespaceSchemaLocation="Program.xsd">
  <MetaData>
    <Meta name="s3bucket">riverscapesdata</Meta>
  </MetaData>
  <Level name="Region">
    <Level name="Watershed">
        <Container name="Watershed">
          <Product name="GRTS Rollup" id="GRTS" folder="grts"/>
          <Product name="Context Layers" id="context" folder="context_layers"/>
        </Container>
        <Container name="Network">
          <Product name="BRAT Models" id="BRAT" folder="brat"/>
            <Product name="WRAT" id="WRAT" folder="wrat"/>
            <Product name="Matt Imputation Crap" id="MIC" folder="matt_impute"/>
            <Product name="GPP" id="GPP" folder="gpp"/>
            <Product name="Capacity" id="capacity" folder="capacity"/>
            <Product name="River Styles" id="RSTYLES" folder="riverstyles"/>
        </Container>
        <Container name="Sites">
          <Level name="Site">
            <Level name="Visit">
              <Level name="Year">
                <Level name="Flow">
                  <Product name="FHM" id="FHM" folder="FHM"/>
                  <Product name="GUT" id="GUT" folder="GUT"/>
                  <Product name="GCD" id="GCD" folder="GCD"/>
                </Level>
                <Container name="Topography">
                  <Product name="DEM" id="DEM" folder="DEM"/>
                </Container>
              </Level>
            </Level>
          </Level>
        </Container>
    </Level>
  </Level>
</Program>